How to obtain the start time and end time of a day?,Datetime,Interval,Period,Duration,,,,
How to determine day of week by passing specific date?,Datetime,DatetimeFormat,,,,,,
Generics Hell -How do I pass a joda.DateTime to Hamcrest Matcher.greaterThan?,ReadableInstant,DateTime,,,,,,
How are times calculated internally?,Datetime,ReadableInstant,ReadablePartial,LocalDate,LocalTime,YearMonthDay,TimeofDay,Instant
"How can I build a list of days, months, years from a calendar object in Java?",Chronology,ISOChronology,DatetimeField,,,,,
How can I get the names of days of week in JodaTime,DateTime.Property,DateTimeConstants,DateTime,Local,,,,
How can I make Joda DateTime parser to only accept strings of form yyyyMMdd?,Datetimeformatbuilder,DateTimeFormatter,DateTImeFieldType,DateTImeFormat,DateTIme,,,
How can I bind a form parameter to a Java 8 Duration using Spring MVC?,Duration,DatetimeFormat,LocalDatetime,,,,,
How do I calculate the difference between two dates?,Period,PeriodType,Days,,,,,
"How do I store a timeline/schedule, location full or empty from time x to y (interval)?",DateTime,DateTimeZone,Interval,Duration,,,,
How is Joda MutableDateTime's setDate(DateTime) method working?,DateTime,DateTimeZone.getAvailableIDs(),MutableDateTime,,,,,
How to add one day to a date?,Datetime,,,,,,,
How to calculate number of event occurrences with Joda Time?,ReadablePeriod,,,,,,,
How to check if a list of intervals (Joda-Time) fully covers a month in Java,MutableInterval,Interval,,,,,,
How to compare date instances in same time zone with different time zone representations?,ISODateTimeFormat,,,,,,,
How to compare DateTime or MutableDateTime objects correctly in Joda Time?,DateTime,,,,,,,
How to compare two Instant based on the date not time,Instant,,,,,,,
How to convert a Instant to a LocalTime?,Instant,LocalTime,,,,,,
How to convert ReadableInstant (Joda Time) to Java Date?,ReadableInstant,,,,,,,
How to Convert type Instant to type XMLGregorianCalendar?,Instant,,,,,,,
how to create a Java Date object of midnight today and midnight tomorrow?,Datemidnight,DateTIme,DateTimeZone,,,,,
how to get any specific date of current year,DateTimeFormat,DateTime,,,,,,
How to get epoch limits of Java 8 chronology?,Chronology,,,,,,,
How to handle jodatime Illegal instant due to time zone offset transition,DateTime,DateTimeZone,,,,,,
How to Instantiate Joda DateTime from TimeZone String ID and Epoch,DateTimeZone,DateTime,,,,,,
How to keep track of non empty field in Joda date buffer,Mutabledatetime,,,,,,,
How to represent Oracle Interval in Java,Interval,,,,,,,
How to retrieve oracle Timestamp column in expected timezone in Java?,DateTime,DateTimeZone,DateTimeFormat,,,,,
How to use DateTimeZone in Java,DateTime,DateTimeZone,,,,,,
"Joda-Time: what's the difference between Period, Interval and Duration?",Interval,Duration,Period,,,,,
